{
  "$schema": "https://json-schema.org/draft/2020-12/schema",
  "$id": "https://ai-development-stack.local/schemas/active-checksums.schema.json",
  "title": "AI Development Stack Active Checksums",
  "type": "object",
  "additionalProperties": false,
  "required": ["schemaVersion", "stackVersion", "algorithm", "files"],
  "properties": {
    "schemaVersion": { "const": 1 },
    "stackVersion": { "type": "string", "pattern": "^(0|[1-9][0-9]*)\\.(0|[1-9][0-9]*)\\.(0|[1-9][0-9]*)$" },
    "algorithm": { "const": "sha256" },
    "files": {
      "type": "array",
      "uniqueItemProperties": ["path"],
      "items": {
        "type": "object",
        "additionalProperties": false,
        "required": ["path", "size", "sha256"],
        "properties": {
          "path": { "type": "string", "pattern": "^(?!/)(?!.*(?:^|/)\\.\\.(?:/|$))[A-Za-z0-9._-]+(?:/[A-Za-z0-9._-]+)*$" },
          "size": { "type": "integer", "minimum": 0 },
          "sha256": { "type": "string", "pattern": "^[0-9a-f]{64}$" }
        }
      }
    }
  }
}
