{
  "schemaVersion": 1,
  "stackVersion": "0.4.0",
  "algorithm": "sha256",
  "files": [
    {
      "path": "docs/architecture/agentic-execution-policy.md",
      "size": 3883,
      "sha256": "e19e1ec0e3c6e2d5c8f78edd0ea86f951398e1ee56d05e7ce522084e0da4e6d7"
    },
    {
      "path": "docs/architecture/authority-model.md",
      "size": 2987,
      "sha256": "867779069f8fbef520c320c98ea1018a2cd77dc7cb3d091d750852018d7efa67"
    },
    {
      "path": "docs/architecture/repository-boundaries.md",
      "size": 3345,
      "sha256": "f57e812fb3caa3364e9824da64660d7cfc0b6b417ca0137fd9287a7627ee7913"
    },
    {
      "path": "docs/architecture/versioning-policy.md",
      "size": 2570,
      "sha256": "062b527b79e4451a392a0e3298d20b06c59db654f915ccdc78ea5f9a3bc773c8"
    },
    {
      "path": "node_modules/ajv-formats/dist/formats.js",
      "size": 12263,
      "sha256": "b61693a26869970a92cc1fe832c931ccd3afe8b6d66802b19c48306349e84880"
    },
    {
      "path": "node_modules/ajv-formats/dist/index.js",
      "size": 1508,
      "sha256": "3f3014150293846086d11058bb8bf43e669e354a98b37adcf10281454d5e753b"
    },
    {
      "path": "node_modules/ajv-formats/dist/limit.js",
      "size": 2900,
      "sha256": "ffc374031a55c3f6e39dc3fe69e663f8251b9d9d7ddb8f513a6807c985c18bb8"
    },
    {
      "path": "node_modules/ajv-formats/package.json",
      "size": 1897,
      "sha256": "402fb4bcfa457f0226813f3976ac42839dd619907c075c108efba8600d7edb69"
    },
    {
      "path": "node_modules/ajv/dist/2020.js",
      "size": 2894,
      "sha256": "908e9670b478b2ba126802a221b7e47006f50cf467e2c5dd7935d3dbef10a20a"
    },
    {
      "path": "node_modules/ajv/dist/ajv.js",
      "size": 2841,
      "sha256": "edaed56fc546f5551b0d6dc2ff2a9cc25c2d6c83318a086eaa8c3ad0b2479297"
    },
    {
      "path": "node_modules/ajv/dist/compile/codegen/code.js",
      "size": 4676,
      "sha256": "1287153722f1fc3c5342647de7ae1d7b6fb68bdb3378a0776a937d273fc97e0d"
    },
    {
      "path": "node_modules/ajv/dist/compile/codegen/index.js",
      "size": 23127,
      "sha256": "f03b2b72597ef86878d1d4030580c2d0964046efad4867f3d05aa91065ba034c"
    },
    {
      "path": "node_modules/ajv/dist/compile/codegen/scope.js",
      "size": 5198,
      "sha256": "d2a0a97af2faa2cad88702314fe421e235ab17f11e0d62883d58d8d4dc734286"
    },
    {
      "path": "node_modules/ajv/dist/compile/errors.js",
      "size": 5771,
      "sha256": "53990f8f2cc05922bba410ae68231d3f869de4f8343277ede5b4834fa564c6c2"
    },
    {
      "path": "node_modules/ajv/dist/compile/index.js",
      "size": 10046,
      "sha256": "05b34da22814f3787bfa3ac68dad59c9047f56e55a607e0a20719ebf5afe69ac"
    },
    {
      "path": "node_modules/ajv/dist/compile/names.js",
      "size": 1440,
      "sha256": "3cab37a2240b996b9bed92fe7a041d91689cfe3ad2e9ae4c0ab99e4146408493"
    },
    {
      "path": "node_modules/ajv/dist/compile/ref_error.js",
      "size": 543,
      "sha256": "81c98fdf34c3037c91bfcc02277ec32156c71e34048f36cfe4e084416e916cb7"
    },
    {
      "path": "node_modules/ajv/dist/compile/resolve.js",
      "size": 5006,
      "sha256": "df75af0e0cf03fa1c6452e8dc61019f5aec645a8a5f6f494dc4e13cb5502d2d9"
    },
    {
      "path": "node_modules/ajv/dist/compile/rules.js",
      "size": 918,
      "sha256": "ec1d86500f497aa8e20f9f0c1695951159d9a909669d00a261ce1bb22b3cf0a9"
    },
    {
      "path": "node_modules/ajv/dist/compile/util.js",
      "size": 7103,
      "sha256": "fa911f5631f29d4d6420adfe086cb693b94b08de2719475c78c54bcb82f831a5"
    },
    {
      "path": "node_modules/ajv/dist/compile/validate/applicability.js",
      "size": 853,
      "sha256": "50c5cba5894a7fb9874b3432355b46ec71b73c9368dafb1323ded8567cca8fc0"
    },
    {
      "path": "node_modules/ajv/dist/compile/validate/boolSchema.js",
      "size": 1531,
      "sha256": "c08abdbdbd3d8b1dcc0552a20fbc7d837ed44f4ca6abb2e464985590ac94377f"
    },
    {
      "path": "node_modules/ajv/dist/compile/validate/dataType.js",
      "size": 8409,
      "sha256": "697bd7005361ec7066a23c18830a10b0ef28aec1a33138b4e3098bf78c4fae52"
    },
    {
      "path": "node_modules/ajv/dist/compile/validate/defaults.js",
      "size": 1448,
      "sha256": "05721971df94faa57b09c8cfd60c2eef81b6d14910a7dea5f539d693a029c428"
    },
    {
      "path": "node_modules/ajv/dist/compile/validate/index.js",
      "size": 20552,
      "sha256": "cb2103e5f890e04592c10d24b45857dad91155bae9f9460138a2459bdaaea2cd"
    },
    {
      "path": "node_modules/ajv/dist/compile/validate/keyword.js",
      "size": 5695,
      "sha256": "ab8f070c75c25eee9be5c837f364748909b58f5db66149a2beccbd2f66afeb76"
    },
    {
      "path": "node_modules/ajv/dist/compile/validate/subschema.js",
      "size": 3858,
      "sha256": "ca783d6052af91e65ebb59a5b48b47fb459a2241d37ca6a042f767d4ce451bdc"
    },
    {
      "path": "node_modules/ajv/dist/core.js",
      "size": 25202,
      "sha256": "51be29c7ed7288622f755c0f1bebd3da4a9907d77aa2c33b0f2a0a5b6b339603"
    },
    {
      "path": "node_modules/ajv/dist/refs/data.json",
      "size": 409,
      "sha256": "d24ab8a97c18b3f5afdde7d7024a0e0ac1df0614a16a41cb88f81379edcc2db3"
    },
    {
      "path": "node_modules/ajv/dist/refs/json-schema-2020-12/index.js",
      "size": 1026,
      "sha256": "2e39089b0aaa14efa7901ecf5384622ec3d5897b206e1d589d2420f17b9fa6e1"
    },
    {
      "path": "node_modules/ajv/dist/refs/json-schema-2020-12/meta/applicator.json",
      "size": 1441,
      "sha256": "f1e465ff0c0cc86bee5c0cc4b51d2734c532e6ea12c75b60a2ac093a4577b2d4"
    },
    {
      "path": "node_modules/ajv/dist/refs/json-schema-2020-12/meta/content.json",
      "size": 479,
      "sha256": "7ede86f2c48d646202bf1332aefaf46db268c943d59752727db7247dc2920516"
    },
    {
      "path": "node_modules/ajv/dist/refs/json-schema-2020-12/meta/core.json",
      "size": 1344,
      "sha256": "c3a5947992d4fe67c95cda7910911207376bbae41c0a124ec9e7e699172e7a49"
    },
    {
      "path": "node_modules/ajv/dist/refs/json-schema-2020-12/meta/format-annotation.json",
      "size": 420,
      "sha256": "1e31131b1ed21f98c007f04deb501343b8c4dd77f1c5a8494a9c2085f68d769d"
    },
    {
      "path": "node_modules/ajv/dist/refs/json-schema-2020-12/meta/meta-data.json",
      "size": 758,
      "sha256": "eb008c756b29bdaa237c1f06d32ea4a21f6ef22148b03c6372cea5e4c0782273"
    },
    {
      "path": "node_modules/ajv/dist/refs/json-schema-2020-12/meta/unevaluated.json",
      "size": 472,
      "sha256": "8f7f75f4274745faa32e4abdba12de99f49b21df225f52f723b5c62043b0edca"
    },
    {
      "path": "node_modules/ajv/dist/refs/json-schema-2020-12/meta/validation.json",
      "size": 2264,
      "sha256": "3cae7069843679429e4ada7df261bb8961fa34cac15be89296026e69af312092"
    },
    {
      "path": "node_modules/ajv/dist/refs/json-schema-2020-12/schema.json",
      "size": 2166,
      "sha256": "5333c7df76bceee098e865881d0808238dea836126c6c60b49299ec85c6c7a56"
    },
    {
      "path": "node_modules/ajv/dist/refs/json-schema-draft-07.json",
      "size": 3811,
      "sha256": "f7e8b13cad4fecff9771f3626fef33e20e59027b90938a28fd9d2f6c17cd0773"
    },
    {
      "path": "node_modules/ajv/dist/runtime/equal.js",
      "size": 286,
      "sha256": "c94467da09ee94e5d194483a7ab821b9bb3bf1c04397270f2ab53dea9de59274"
    },
    {
      "path": "node_modules/ajv/dist/runtime/ucs2length.js",
      "size": 808,
      "sha256": "1df012dd3d23fced07255a7204798004509687cb1f431ae0ab976db436bbd890"
    },
    {
      "path": "node_modules/ajv/dist/runtime/uri.js",
      "size": 218,
      "sha256": "d1d61baf97ed87d7310df847a78ed73d19c8cc003207bf5aaec977500bdb1578"
    },
    {
      "path": "node_modules/ajv/dist/runtime/validation_error.js",
      "size": 337,
      "sha256": "11bf5b4affc8114e5e7cdf65b93006c2d997ab60ada1152c22e136f9b828b815"
    },
    {
      "path": "node_modules/ajv/dist/vocabularies/applicator/additionalItems.js",
      "size": 1931,
      "sha256": "7beb0fbda5e349907067c8398bb8cc3260a6267b6e5dff9793a5ab2171934099"
    },
    {
      "path": "node_modules/ajv/dist/vocabularies/applicator/additionalProperties.js",
      "size": 4309,
      "sha256": "e237cb180cd2e3f2e676feb714d7dcc6a42116640f9db2ad830cd20d9dfc540a"
    },
    {
      "path": "node_modules/ajv/dist/vocabularies/applicator/allOf.js",
      "size": 756,
      "sha256": "98f46a6434ebe5f851b406480e18b776dd7f1bcc275e28c16a13bfef3cc067c7"
    },
    {
      "path": "node_modules/ajv/dist/vocabularies/applicator/anyOf.js",
      "size": 343,
      "sha256": "8d7368d4aebad0514b713191b934993b4f0bf570e1bab93b07dc69712db2cec5"
    },
    {
      "path": "node_modules/ajv/dist/vocabularies/applicator/contains.js",
      "size": 3680,
      "sha256": "56165dc93cd8b0b4611db50a97f1e7d7f9af6c5ffe95a7a5b054d6eeaa7f6a8c"
    },
    {
      "path": "node_modules/ajv/dist/vocabularies/applicator/dependencies.js",
      "size": 3198,
      "sha256": "c1a83bf484b6fde4d268935f079ddba5e74a2f589dfc6d15ca2e20ba4d06ee5b"
    },
    {
      "path": "node_modules/ajv/dist/vocabularies/applicator/dependentSchemas.js",
      "size": 354,
      "sha256": "d17d23755b0cf8699c180dd98b8b7270b688d2e4fe5a4c4fcc53ffdcc18ee58e"
    },
    {
      "path": "node_modules/ajv/dist/vocabularies/applicator/if.js",
      "size": 2438,
      "sha256": "42374ee5dc681433579cc689b0c4ae5343f5bf78d4d6a561722b9277c5335ec4"
    },
    {
      "path": "node_modules/ajv/dist/vocabularies/applicator/index.js",
      "size": 1529,
      "sha256": "5a61978f6d81bbabfa8b9ccb71d7de816ed6dd1fd7de5c72657439a76c2a7cb3"
    },
    {
      "path": "node_modules/ajv/dist/vocabularies/applicator/items.js",
      "size": 1993,
      "sha256": "fa87f74adc3aac1f1b5e3e7dddf73294e6850e1dd49ed131fca4352e9645c54e"
    },
    {
      "path": "node_modules/ajv/dist/vocabularies/applicator/items2020.js",
      "size": 1037,
      "sha256": "c449ef64aec16263c7935293ed450cfc2da3ba66f6df5f99c3198c05f169838f"
    },
    {